{
  "meta": {
    "title": "Эстетика — студия красоты в Екатеринбурге",
    "description": "Студия «Эстетика»: сложное окрашивание, восстановление волос и уход. Смотрите работы с фотографиями «до и после» и записывайтесь онлайн.",
    "domain": "https://sabutorin97-boop.github.io/remix-of-ai-business-solutions/",
    "theme": "theme-b",
    "lang": "ru"
  },
  "brand": {
    "name": "Студия «Эстетика»",
    "tagline": "Студия красоты в Екатеринбурге: сложное окрашивание и восстановление волос",
    "logo": null,
    "social": [],
    "accent_override": null
  },
  "hero": {
    "headline": "Окрашивание, после которого волосы не приходится восстанавливать",
    "subline": "Работаем с длиной от 40 см и с любой историей окрашиваний: смываем чёрный, выводим из рыжего, возвращаем блонд без пережжённых концов. Каждую работу показываем «до и после» — придумывать нечего.",
    "cta_text": "Записаться на консультацию",
    "cta_url": "#contact",
    "media": "img/hero.svg",
    "media_alt": "Зал студии «Эстетика» с зеркалами и креслами"
  },
  "approach": [
    {
      "title": "Сначала диагностика, потом цвет",
      "text": "На консультации смотрим состояние волос под увеличением и проверяем реакцию на осветлитель на отдельной пряди. Если за одно посещение результат не выйдет, говорим об этом до записи, а не в кресле."
    },
    {
      "title": "План на несколько визитов, если нужно",
      "text": "Чёрный или многолетний рыжий не убирается за раз без потери длины. Расписываем этапы с датами и стоимостью каждого, чтобы вы понимали бюджет заранее."
    },
    {
      "title": "Уход, который работает дома",
      "text": "После окрашивания подбираем два-три средства под ваш бюджет и показываем, как ими пользоваться. Без набора из восьми банок, половина которых стоит без дела."
    }
  ],
  "cases": [
    {
      "client": "Мария, 34 года",
      "niche": "Сложное окрашивание",
      "pain": "Четыре года красилась в чёрный дома, решила вернуться в русый. Два мастера до нас отказались, третий предложил постричься до плеч.",
      "solution": "Сделали три смывки с перерывом в две недели, между ними — протеиновое восстановление. Длину сохранили полностью, в финале затонировали в холодный русый.",
      "result": "Русый цвет без рыжих пятен, длина осталась прежней. Через полгода клиентка вернулась на поддерживающее тонирование, состояние волос — без ломкости.",
      "numbers": [
        {
          "value": "3",
          "label": "визита до результата"
        },
        {
          "value": "0 см",
          "label": "потеряно длины"
        },
        {
          "value": "6 месяцев",
          "label": "держится цвет"
        }
      ],
      "image": "img/case-1.svg",
      "image_alt": "Волосы до и после выхода из чёрного цвета",
      "url": null,
      "quote": "Я пришла готовая расстаться с длиной. Ушла с русым цветом и своими волосами до лопаток.",
      "quote_author": "Мария"
    },
    {
      "client": "Ольга, 41 год",
      "niche": "Восстановление волос",
      "pain": "После неудачного осветления в другом салоне волосы тянулись и рвались при расчёсывании, концы напоминали паклю.",
      "solution": "Отказались от окрашивания на два месяца. Провели курс из четырёх процедур с протеинами и липидами, подстригли 4 см самой повреждённой длины, собрали домашний уход из трёх средств.",
      "result": "Волосы перестали рваться, расчёсывание занимает минуту вместо десяти. Через два месяца сделали мягкое тонирование без осветления.",
      "numbers": [
        {
          "value": "4",
          "label": "визита до результата"
        },
        {
          "value": "4 см",
          "label": "потеряно длины"
        },
        {
          "value": "2 месяца",
          "label": "до первого окрашивания"
        }
      ],
      "image": "img/case-2.svg",
      "image_alt": "Волосы до и после курса восстановления",
      "url": null,
      "quote": null,
      "quote_author": null
    },
    {
      "client": "Анна, 28 лет",
      "niche": "Блонд",
      "pain": "Отросшие корни и желтизна по длине: ходила подкрашиваться каждые три недели и всё равно была недовольна оттенком.",
      "solution": "Перевели на технику растяжки цвета с мягкой границей у корней и подобрали тонирование холодного оттенка с запасом на вымывание.",
      "result": "Между визитами теперь восемь недель вместо трёх. Желтизна не проявляется на пятой неделе, как раньше, а бюджет на окрашивание снизился вдвое.",
      "numbers": [
        {
          "value": "8 недель",
          "label": "между визитами"
        },
        {
          "value": "−50%",
          "label": "бюджет на окрашивание"
        }
      ],
      "image": "img/case-3.svg",
      "image_alt": "Блонд с растяжкой цвета",
      "url": null,
      "quote": "Перестала считать дни до подкрашивания корней.",
      "quote_author": "Анна"
    }
  ],
  "reviews": [
    {
      "author": "Екатерина",
      "role": "клиентка с 2024 года",
      "text": "Первый раз пришла с запросом «уберите рыжий, только не обрежьте». Объяснили, что за один визит не выйдет, расписали два этапа и цену каждого. Всё совпало с тем, что сказали на консультации.",
      "photo": "img/review-1.svg"
    },
    {
      "author": "Дарья",
      "role": "клиентка",
      "text": "Ценю, что не продают лишний уход. Спросила про набор из рекламы — сказали, что мне он не нужен, и подобрали два средства дешевле.",
      "photo": null
    }
  ],
  "faq": [
    {
      "q": "Сколько стоит сложное окрашивание?",
      "a": "Стоимость зависит от длины волос и от того, сколько окрашиваний было раньше. Работа на длине до плеч начинается от 6 000 рублей, длина ниже лопаток с выходом из тёмного цвета обходится в 12 000–18 000 рублей за визит. Точную сумму называем на бесплатной консультации после диагностики: смотрим состояние волос и проверяем реакцию на осветлитель. Если результат потребует нескольких визитов, расписываем стоимость каждого этапа заранее, чтобы итоговая сумма не оказалась сюрпризом."
    },
    {
      "q": "Можно ли вернуться в блонд после чёрного цвета?",
      "a": "Чаще всего можно, но не за один визит и не всегда с сохранением всей длины. Мы делаем смывку в несколько подходов с перерывом в две недели, между ними проводим восстановление. Сколько понадобится визитов, видно после первой пробной пряди: она показывает, как волосы отдают пигмент. Если состояние волос не позволяет получить блонд без потери длины, говорим об этом до записи и предлагаем промежуточный вариант — например, тёплый русый."
    },
    {
      "q": "Как записаться в студию?",
      "a": "Записаться можно в Telegram или по телефону в рабочие часы студии. Напишите желаемую дату, длину волос и приложите фото при дневном свете — так администратор сразу подберёт мастера и заложит нужное время. На сложное окрашивание записываем только после консультации: она занимает двадцать минут, бесплатна и ни к чему не обязывает. Отменить или перенести визит можно не позднее чем за сутки, тогда предоплата сохраняется на следующую запись."
    },
    {
      "q": "Есть ли гарантия на окрашивание?",
      "a": "Если оттенок получился не таким, как договаривались на консультации, мы исправляем его бесплатно в течение двух недель после визита. Гарантия не распространяется на изменения цвета из-за домашних окрашиваний, бассейна с хлором и ухода с агрессивными шампунями — об этих ограничениях мастер предупреждает заранее и выдаёт памятку. Спорные случаи разбираем вместе с фотографиями «до и после», которые делаем при каждом визите."
    },
    {
      "q": "Сколько времени занимает визит?",
      "a": "Консультация с диагностикой — двадцать минут. Тонирование или окрашивание корней занимает полтора-два часа. Сложное окрашивание с осветлением длины идёт от четырёх до шести часов, поэтому такие работы мы ставим на первую половину дня и заранее предупреждаем о времени. Курс восстановления — по часу за визит. Точный интервал администратор называет при записи, чтобы вы могли спланировать день и не торопить мастера."
    }
  ],
  "contacts": {
    "phone": "+7 000 000-00-00",
    "email": "demo@example.com",
    "address": "Екатеринбург, адрес демонстрационный",
    "hours": "Пн–Сб с 10:00 до 21:00"
  },
  "cta": {
    "title": "Записаться на консультацию",
    "text": "Расскажите про волосы и желаемый цвет — ответим, что реально сделать за один визит, а что потребует нескольких.",
    "button": "Записаться на консультацию",
    "url": "#contact",
    "form": true
  },
  "legal": {
    "entity": "Демонстрационный пример, не организация",
    "inn": null,
    "privacy_contact": "demo@example.com"
  }
}
