{
  "meta": {
    "title": "Гараж 96 — ремонт подвески в Екатеринбурге",
    "description": "Сервис «Гараж 96»: диагностика и ремонт подвески с фотоотчётом по каждой детали. Примеры работ, сроки и цены.",
    "domain": "https://example.com",
    "theme": "theme-a",
    "lang": "ru"
  },
  "brand": {
    "name": "Гараж 96",
    "tagline": "Ремонт подвески и рулевого управления в Екатеринбурге"
  },
  "hero": {
    "headline": "Показываем, что именно сломалось, до начала ремонта",
    "subline": "Дефектовка с фотографиями и объяснением, что можно отложить, а что менять сейчас. Без «у вас тут всё надо менять» и без работ, о которых вы узнаёте из чека.",
    "cta_text": "Записаться на диагностику",
    "cta_url": "#contact"
  },
  "approach": [
    {
      "title": "Сначала смотрим, потом считаем",
      "text": "Диагностика на подъёмнике занимает сорок минут. По каждой детали делаем фото и объясняем, чем грозит износ: сколько ещё проходит и что будет, если тянуть."
    },
    {
      "title": "Разделяем «сейчас» и «потом»",
      "text": "В смете две части: что влияет на безопасность и требует замены сразу, и что подождёт до следующего визита. Решение за вами, мы не считаем за клиента."
    },
    {
      "title": "Отдаём старые детали",
      "text": "Снятые запчасти складываем в коробку и показываем при выдаче машины. Проверить, что заменили именно их, можно не выходя из сервиса."
    }
  ],
  "cases": [
    {
      "client": "Skoda Octavia, 2016",
      "niche": "Диагностика подвески",
      "pain": "Стук на мелких неровностях. В двух сервисах предложили заменить стойки амортизаторов в сборе, сумма выходила за тридцать тысяч рублей.",
      "solution": "Разобрали переднюю подвеску, нашли разбитые втулки стабилизатора. Заменили втулки и стойки стабилизатора, амортизаторы оставили — их ресурс оказался в норме.",
      "result": "Стук ушёл в тот же день, ремонт обошёлся в четыре раза дешевле предложенного в других сервисах. Через год владелец приехал на плановую диагностику: замена держится.",
      "numbers": [
        { "value": "4 500 ₽", "label": "стоимость ремонта" },
        { "value": "1 день", "label": "срок работы" }
      ],
      "image": "img/case-1.svg",
      "image_alt": "Схема передней подвески с отмеченными деталями"
    },
    {
      "client": "Kia Rio, 2019",
      "niche": "Геометрия и развал",
      "pain": "После ям увело руль, шины стирались по внутренней кромке за один сезон — комплект резины уходил каждый год.",
      "solution": "Проверили геометрию кузова, заменили погнутый рычаг и сделали развал-схождение на стенде с распечаткой значений до и после.",
      "result": "Руль стоит ровно, износ шин равномерный третий сезон подряд. Комплект резины вместо одного сезона ходит три.",
      "numbers": [
        { "value": "3 сезона", "label": "срок службы шин" },
        { "value": "1 день", "label": "срок работы" }
      ],
      "image": "img/case-2.svg",
      "image_alt": "Стенд развала-схождения с распечаткой значений"
    },
    {
      "client": "Renault Duster, 2018",
      "niche": "Рулевое управление",
      "pain": "Гул на скорости выше восьмидесяти и люфт в руле. Владелец готовился менять рулевую рейку, это самая дорогая позиция в ремонте.",
      "solution": "Проверили рейку под нагрузкой — она оказалась целой. Гул давал изношенный ступичный подшипник, люфт шёл от рулевых наконечников. Заменили и то, и другое.",
      "result": "Гул и люфт ушли, рейка осталась родной. Сэкономили владельцу около сорока тысяч рублей на детали, которую менять не требовалось.",
      "numbers": [
        { "value": "40 000 ₽", "label": "сэкономлено на замене" },
        { "value": "2 дня", "label": "срок работы" }
      ],
      "image": "img/case-3.svg",
      "image_alt": "Снятые детали рулевого управления"
    }
  ],
  "faq": [
    {
      "q": "Сколько стоит диагностика подвески?",
      "a": "Диагностика на подъёмнике стоит тысячу рублей и занимает около сорока минут. Если вы соглашаетесь на ремонт в этот же визит, стоимость диагностики вычитается из суммы работ. По результатам вы получаете список деталей с фотографиями и пометкой, что менять сейчас, а что подождёт до следующего раза. Смету согласовываем до начала работ: ни одна позиция не появляется в чеке без вашего согласия."
    },
    {
      "q": "Можно ли привезти свои запчасти?",
      "a": "Можно, мы работаем и со своими деталями клиента. Единственное условие: гарантия в этом случае распространяется только на работу, а не на саму запчасть. Если деталь окажется бракованной или не подойдёт по каталожному номеру, повторная замена оплачивается отдельно. Мастер проверит номер до начала работ и скажет, если привезённая деталь не подходит к вашей комплектации."
    },
    {
      "q": "Сколько времени занимает ремонт?",
      "a": "Замена втулок и стоек стабилизатора укладывается в один рабочий день. Ремонт рулевого управления и работы с геометрией занимают до двух дней, потому что после замены деталей нужно заново выставить развал-схождение. Если нужной запчасти нет в наличии, срок зависит от поставки: по популярным моделям это один-два дня, по редким мастер называет дату при согласовании сметы."
    },
    {
      "q": "Есть ли гарантия на ремонт?",
      "a": "На работу гарантия шесть месяцев, на детали — гарантия производителя, обычно от года. Если в этот срок появится та же неисправность, мы разбираем узел повторно бесплатно. Гарантия не действует на последствия аварий и езды по бездорожью, об этом мастер предупреждает при выдаче машины. Все работы фиксируются в заказ-наряде, по нему и разбираем спорные случаи."
    }
  ],
  "contacts": {
    "phone": "+7 000 000-00-00",
    "email": "demo@example.com",
    "address": "Екатеринбург, адрес демонстрационный",
    "hours": "Пн–Пт с 9:00 до 20:00, Сб с 10:00 до 17:00"
  },
  "cta": {
    "title": "Записаться на диагностику",
    "text": "Опишите, что беспокоит в машине — скажем, сколько займёт диагностика и в какой день есть место на подъёмнике.",
    "url": "#contact",
    "form": true
  },
  "legal": {
    "entity": "Демонстрационный пример, не организация",
    "privacy_contact": "demo@example.com"
  }
}
