{
  "meta": {
    "title": "Кораблёв и партнёры — арбитражные споры в Екатеринбурге",
    "description": "Юридическая практика по арбитражным спорам и банкротству: разбор дела до договора, фиксированная стоимость этапов, отчёт после каждого заседания.",
    "domain": "https://sabutorin97-boop.github.io/remix-of-ai-business-solutions/legal/",
    "theme": "theme-d",
    "lang": "ru"
  },
  "brand": {
    "name": "Кораблёв и партнёры",
    "tagline": "Арбитражные споры и банкротство: ведём дела предпринимателей в Екатеринбурге"
  },
  "hero": {
    "headline": "Говорим о шансах до подписания договора, а не после",
    "subline": "Разбираем документы и называем вероятный исход прямо на первой встрече. Если дело проигрышное, так и скажем: браться за безнадёжный спор ради гонорара мы не станем.",
    "cta_text": "Разобрать дело",
    "cta_url": "#contact"
  },
  "approach": [
    {
      "title": "Сначала документы, потом обещания",
      "text": "На первой встрече читаем договоры и переписку. По итогу вы получаете письменную оценку: что подтверждено документами, чего не хватает и какой исход вероятен."
    },
    {
      "title": "Стоимость этапами, а не «по факту»",
      "text": "Каждый этап — подготовка иска, первая инстанция, апелляция — стоит фиксированную сумму, известную заранее. Проценты от взысканного обсуждаем отдельно и только по желанию клиента."
    },
    {
      "title": "Отчёт после каждого заседания",
      "text": "В день заседания присылаем, что произошло, что решил суд и что делаем дальше. Узнавать о ходе своего дела из картотеки арбитражных дел не придётся."
    }
  ],
  "cases": [
    {
      "client": "Поставщик оборудования",
      "niche": "Взыскание задолженности",
      "pain": "Покупатель принял оборудование, подписал накладные и перестал отвечать. Долг 4,8 миллиона рублей, переписка велась в мессенджере, часть договорённостей была только на словах.",
      "solution": "Собрали доказательства из накладных и переписки, заявили обеспечительные меры на счета до рассмотрения дела. Параллельно направили претензию с расчётом неустойки по договору.",
      "result": "Обеспечительные меры наложены через две недели после иска, после чего покупатель вышел на связь и погасил долг с неустойкой до решения суда.",
      "numbers": [
        {
          "value": "4,8 млн ₽",
          "label": "взыскано"
        },
        {
          "value": "2 месяца",
          "label": "срок до оплаты"
        }
      ],
      "image": "img/case-1.svg",
      "image_alt": "Схема движения документов по делу о взыскании"
    },
    {
      "client": "Производственная компания",
      "niche": "Защита от банкротства",
      "pain": "Кредитор подал заявление о банкротстве из-за просрочки по одному договору. Работа компании могла встать на время процедуры, хотя выручка позволяла рассчитаться.",
      "solution": "Оспорили размер требований: часть неустойки была начислена сверх условий договора. Согласовали график погашения и заключили мировое соглашение до введения процедуры.",
      "result": "Заявление о банкротстве прекращено, компания продолжила работу. Требования кредитора уменьшены почти на треть за счёт пересчёта неустойки.",
      "numbers": [
        {
          "value": "−31%",
          "label": "размер требований"
        },
        {
          "value": "3 месяца",
          "label": "срок до мирового"
        }
      ],
      "image": "img/case-2.svg",
      "image_alt": "График погашения по мировому соглашению"
    },
    {
      "client": "Подрядчик в строительстве",
      "niche": "Споры по подряду",
      "pain": "Заказчик отказался принимать работы и оплачивать последний этап, ссылаясь на недостатки. Своей экспертизы у подрядчика не было, срок на возражения истекал.",
      "solution": "Организовали независимую экспертизу объёма и качества работ, оформили односторонние акты по правилам договора и вышли в суд с расчётом по фактически выполненному.",
      "result": "Суд взыскал стоимость последнего этапа и расходы на экспертизу. Замечания заказчика подтвердились лишь частично и на сумму почти не повлияли.",
      "numbers": [
        {
          "value": "2,1 млн ₽",
          "label": "взыскано"
        },
        {
          "value": "1 инстанция",
          "label": "дело закрыто"
        }
      ],
      "image": "img/case-3.svg",
      "image_alt": "Акты выполненных работ и заключение экспертизы"
    }
  ],
  "faq": [
    {
      "q": "Сколько стоит ведение арбитражного дела?",
      "a": "Стоимость считается по этапам, и каждый этап известен заранее. Подготовка иска с полным разбором документов — от 40 000 рублей, ведение дела в первой инстанции — от 90 000 рублей, апелляция считается отдельно. Процент от взысканного мы не навязываем: он обсуждается только по желанию клиента и вместо части фиксированной суммы. Первая встреча с оценкой перспектив дела бесплатна и ни к чему не обязывает."
    },
    {
      "q": "Берётесь ли вы за дела с небольшой суммой?",
      "a": "Берёмся, но честно считаем экономику до договора. Если расходы на юриста, экспертизу и госпошлину сопоставимы с суммой спора, мы об этом скажем и предложим другой путь: претензию, переговоры или взыскание в упрощённом порядке без нашего участия в заседаниях. Смысла вести дело, где выигрыш не покроет расходы, нет ни для вас, ни для нас."
    },
    {
      "q": "Нужно ли мне присутствовать в суде?",
      "a": "В большинстве арбитражных дел присутствие клиента не требуется: мы представляем интересы по доверенности и сами являемся на заседания. Исключения бывают, когда суд вызывает руководителя для пояснений по фактам — о таких случаях предупреждаем заранее и готовим к вопросам. После каждого заседания присылаем отчёт о том, что произошло и что делаем дальше."
    },
    {
      "q": "Что делать, если уже подали заявление о банкротстве?",
      "a": "Главное — не пропустить срок на возражения, он короткий. Начинаем с проверки размера требований: часто часть неустойки или процентов начислена сверх условий договора, и после пересчёта сумма перестаёт быть критичной. Дальше возможны мировое соглашение с графиком платежей или оспаривание самого заявления. Приходите с договорами и перепиской — на первой встрече скажем, что реально сделать в вашем случае."
    }
  ],
  "contacts": {
    "phone": "+7 000 000-00-00",
    "email": "demo@example.com",
    "address": "Екатеринбург, адрес демонстрационный",
    "hours": "Пн–Пт с 9:30 до 19:00"
  },
  "cta": {
    "title": "Разобрать дело",
    "text": "Пришлите договор и переписку — на первой встрече скажем, что подтверждено документами и какой исход вероятен.",
    "url": "#contact",
    "form": true
  },
  "legal": {
    "entity": "Демонстрационный пример, не организация",
    "privacy_contact": "demo@example.com"
  }
}
